{
  "$comment": "Generated by scripts/make-reference-unit.ts (spec 110). Durations are what the clips were authored at.",
  "formatVersion": 1,
  "id": "mannequin-dev.core",
  "skeletonRef": "mannequin-dev.skeleton.json",
  "clips": [
    {
      "id": "idle",
      "source": "clips/idle.glb",
      "durationMs": 2400,
      "loop": true,
      "events": []
    },
    {
      "id": "walk",
      "source": "clips/walk.glb",
      "durationMs": 1000,
      "loop": true,
      "events": [
        {
          "name": "footstep.l",
          "normalizedTime": 0.08
        },
        {
          "name": "footstep.r",
          "normalizedTime": 0.58
        }
      ]
    },
    {
      "id": "run",
      "source": "clips/run.glb",
      "durationMs": 640,
      "loop": true,
      "events": [
        {
          "name": "footstep.l",
          "normalizedTime": 0.05
        },
        {
          "name": "footstep.r",
          "normalizedTime": 0.55
        }
      ]
    },
    {
      "id": "slash",
      "source": "clips/slash.glb",
      "durationMs": 900,
      "loop": false,
      "events": [
        {
          "name": "swing.start",
          "normalizedTime": 0.018867924528301886
        },
        {
          "name": "swing.impact",
          "normalizedTime": 0.55
        }
      ]
    }
  ]
}
