{
  "$comment": "Generated by Studio export from job cda62fdb-fa04-4596-8cf9-9b369ccf3d60.",
  "formatVersion": 1,
  "id": "biped.core",
  "skeletonRef": "../biped.skeleton.json",
  "clips": [
    {
      "id": "cast",
      "source": "clips/cast.glb",
      "durationMs": 1250,
      "loop": false,
      "events": []
    },
    {
      "id": "defeat_02",
      "source": "clips/defeat_02.glb",
      "durationMs": 8500,
      "loop": false,
      "events": []
    },
    {
      "id": "hurt",
      "source": "clips/hurt.glb",
      "durationMs": 13875,
      "loop": false,
      "events": []
    },
    {
      "id": "idle",
      "source": "clips/idle.glb",
      "durationMs": 15375,
      "loop": true,
      "events": []
    },
    {
      "id": "run",
      "source": "clips/run.glb",
      "durationMs": 1292,
      "loop": true,
      "events": []
    },
    {
      "id": "shoot",
      "source": "clips/shoot.glb",
      "durationMs": 1150,
      "loop": false,
      "events": []
    },
    {
      "id": "slash",
      "source": "clips/slash.glb",
      "durationMs": 800,
      "loop": false,
      "events": [
        {
          "name": "swing.start",
          "normalizedTime": 0
        },
        {
          "name": "swing.impact",
          "normalizedTime": 0.55
        }
      ]
    },
    {
      "id": "walk",
      "source": "clips/walk.glb",
      "durationMs": 2375,
      "loop": true,
      "events": []
    }
  ]
}
