{
  "$comment": "Generated by Studio export from job 2e2671c3-933a-417d-8427-97b7c627e0c9.",
  "formatVersion": 1,
  "id": "pig.core",
  "skeletonRef": "../pig.skeleton.json",
  "clips": [
    {
      "id": "defeat_02",
      "source": "clips/defeat_02.glb",
      "durationMs": 8500,
      "loop": false,
      "events": []
    },
    {
      "id": "hurt",
      "source": "clips/hurt.glb",
      "durationMs": 13875,
      "loop": false,
      "events": []
    },
    {
      "id": "idle",
      "source": "clips/idle.glb",
      "durationMs": 15375,
      "loop": true,
      "events": []
    },
    {
      "id": "run",
      "source": "clips/run.glb",
      "durationMs": 1292,
      "loop": true,
      "events": []
    },
    {
      "id": "walk",
      "source": "clips/walk.glb",
      "durationMs": 2375,
      "loop": true,
      "events": []
    }
  ]
}
